{
  "ticket_id": "HARNESS-5",
  "title": "Cross-Platform Portability",
  "type": "Story",
  "requirements": "Scripts work on Windows (MSYS/Git Bash), macOS, and Linux without modification.\n\n1. Audit and fix grep usage:\n   - Replace all grep -P with grep -E across all scripts\n   - Verify no grep flags incompatible with macOS default grep\n   - Update REPAIR_KNOWLEDGE.json: promote repair-1 to 'high' confidence, mark as applied\n\n2. Fix hardcoded paths:\n   - Replace hardcoded Windows gitleaks path in run-secret-scan.sh with: GITLEAKS=$(command -v gitleaks 2>/dev/null || which gitleaks 2>/dev/null)\n   - Replace any hardcoded path separators (backslash) with forward slash\n   - Audit all scripts for C:\\ or Windows-specific paths\n\n3. Fix bash version compatibility:\n   - Audit all scripts for bash 4+ features (associative arrays declare -A, mapfile, readarray, ${var,,} lowercase)\n   - Replace with POSIX-compatible alternatives where possible\n   - Where bash 4+ is required: add version check at script top\n\n4. Fix date command portability:\n   - Audit all scripts using date: macOS uses BSD date, Linux uses GNU date\n   - Replace date -d (GNU) with portable alternative\n   - Test timestamp generation on both platforms\n\n5. Add platform detection to scripts/output.sh:\n   - Detect PLATFORM via uname -s\n   - Set IS_WINDOWS, IS_MACOS, IS_LINUX booleans\n   - Scripts that need platform-specific behavior source this file\n\n6. Write tests:\n   - Run all scripts through shellcheck (static analysis for portability)\n   - Test gitleaks path resolution with gitleaks in PATH vs not\n   - Test timestamp generation matches ISO 8601 format\n   - Verify no grep -P remains in any script\n   - Verify no hardcoded Windows paths remain",
  "acceptance_criteria": [
    "No grep -P usage remains in any script (all replaced with grep -E)",
    "No hardcoded Windows paths in any script",
    "run-secret-scan.sh uses dynamic gitleaks path resolution",
    "All bash 4+ features have POSIX alternatives or version checks",
    "date commands are portable across macOS BSD date and GNU date",
    "scripts/output.sh includes platform detection (IS_WINDOWS, IS_MACOS, IS_LINUX)",
    "REPAIR_KNOWLEDGE.json repair-1 promoted to high confidence",
    "shellcheck passes on all scripts",
    "All tests pass"
  ],
  "repo": "HARNESS",
  "linked_issues": ["HARNESS-3"]
}
