{
  "ticket_id": "HARNESS-4",
  "title": "Structured Escalation & Abort Cleanup",
  "type": "Story",
  "requirements": "Categorize escalations for faster triage. Clean abort without orphaned state.\n\n1. Create schemas/escalation.schema.json with fields:\n   - ticket (PROJ-123 format), escalations array with: id (esc-NNN), timestamp (ISO 8601), category (enum: blocked_dependency, test_failure, merge_conflict, review_stall, secret_detected, infra_failure, contradictory_feedback, team_conflict, unknown), severity (enum: critical, high, medium), source_agent, stage, context object (summary, details, artifacts array, suggested_action), resolved (boolean), resolved_at (nullable ISO 8601)\n\n2. Create scripts/escalate.sh:\n   - Args: <ticket_id> <category> <severity> <source_agent> <stage> <summary> [--details '...'] [--suggested-action '...']\n   - Writes runs/{ticket_id}/ESCALATION.json (appends to array if file exists)\n   - Logs EVENT to run.log\n   - Calls notify.sh with escalation event\n   - Updates PRD.json status to 'escalated' via update-prd-status.sh\n   - Output: structured JSON confirmation\n\n3. Replace ad-hoc escalations in CLAUDE.md:\n   - Replace all 'ESCALATE' instructions with escalate.sh calls specifying category + severity\n   - Map existing triggers to categories per the improvement plan mapping table\n\n4. Create scripts/abort-run.sh:\n   - Args: <ticket_id> <reason>\n   - Steps: check for open draft PR and close it, update PRD.json overall_status to 'aborted', write ESCALATION.json, log EVENT, call run-summary.sh with status 'aborted', if jira input: transition ticket back\n   - Does NOT remove worktree or delete branches\n   - Output: JSON summary of cleanup actions taken\n\n5. Integrate abort into pause/stop:\n   - Update CLAUDE.md: --stop now calls abort-run.sh for full cleanup\n   - --pause checkpoints state but does NOT abort (existing behavior)\n   - Update parse-args.sh to pass abort reason if provided\n\n6. Update dashboard:\n   - Update dashboard/server.js: include ESCALATION.json in artifact merge\n   - Update dashboard/index.html: add Escalations tab per ticket with category badge, severity color, summary, suggested action, timestamp. Sort by severity (critical first)\n\n7. Write tests:\n   - Test escalate.sh with each category (expect valid ESCALATION.json)\n   - Test escalate.sh appending to existing file (expect array grows)\n   - Test abort-run.sh with open draft PR (expect PR closed)\n   - Test abort-run.sh with no PR (expect graceful skip)\n   - Test abort-run.sh preserves worktree",
  "acceptance_criteria": [
    "schemas/escalation.schema.json exists with all required fields and enums",
    "scripts/escalate.sh creates valid ESCALATION.json with category, severity, context",
    "escalate.sh appends to existing ESCALATION.json without overwriting",
    "escalate.sh logs EVENT and calls notify.sh",
    "CLAUDE.md ESCALATE instructions replaced with escalate.sh calls with correct categories",
    "scripts/abort-run.sh exists and handles PR close, PRD status update, logging",
    "abort-run.sh preserves worktree and branches",
    "--stop flag calls abort-run.sh for cleanup",
    "Dashboard shows Escalations tab with category badges and severity colors",
    "All tests pass"
  ],
  "repo": "HARNESS",
  "linked_issues": ["HARNESS-3"]
}
