{
  "ticket_id": "HARNESS-3",
  "title": "Schema Validation & Error Standardization",
  "type": "Story",
  "requirements": "Full JSON Schema validation with AJV. Consistent error output from all scripts.\n\n1. Replace custom validator with standalone AJV:\n   - Bundle AJV + ajv-formats as standalone script using esbuild: scripts/ajv-bundle.js\n   - Self-contained, runs with just node scripts/ajv-bundle.js\n   - Rewrite scripts/validate-schemas.js:\n     - Use bundled AJV with draft 2020-12 support\n     - Validate types, patterns, enums, nested objects, $ref resolution\n     - Mode 1 (no args): validate all schema files are valid schemas\n     - Mode 2 (data.json schema_name): validate data file against named schema\n     - Output: JSON with valid (bool), errors[] (path, message, expected)\n   - Preserve existing exit codes (0=valid, 1=invalid)\n\n2. Add schema validation to write points:\n   - Update scripts/write-conflict-json.sh: validate output against conflict.schema.json before writing\n   - Update scripts/run-secret-scan.sh: validate SECRETS.json against secrets.schema.json before writing\n   - Update scripts/update-prd-status.sh: validate PRD.json after status update\n   - Update scripts/auto-repair.sh record: validate entry against repair.schema.json\n   - Update scripts/agent-learning.sh write: validate entry against agent-learning.schema.json\n   - On validation failure: log ERROR, write invalid data to {file}.invalid.json for debugging, exit 1\n\n3. Standardize script error output:\n   - Create scripts/output.sh sourced by all scripts:\n     - emit_result() { echo \"{\\\"status\\\":\\\"$1\\\",\\\"data\\\":$2}\"; }\n     - emit_error() { echo \"{\\\"status\\\":\\\"error\\\",\\\"error\\\":\\\"$1\\\",\\\"exit_code\\\":${2:-1}}\"; exit ${2:-1}; }\n   - Update all scripts to use emit_error for error exits\n   - Prioritize scripts that compose: resolve-repo.sh, validate-branch-name.sh, merge-base-into-feature.sh\n\n4. Write tests:\n   - Test AJV validator against all existing schema files (expect all valid)\n   - Test with intentionally malformed PRD.json (expect specific error messages)\n   - Test with invalid enum value (expect pattern/enum error)\n   - Test schema validation at write points (expect invalid data caught)\n   - Test standardized error output from 3+ scripts",
  "acceptance_criteria": [
    "scripts/ajv-bundle.js exists as self-contained AJV bundle",
    "scripts/validate-schemas.js uses AJV with draft 2020-12 support",
    "validate-schemas.js supports both modes: schema-only validation and data-against-schema validation",
    "All write-point scripts validate JSON output against schemas before writing",
    "Invalid data written to .invalid.json for debugging on validation failure",
    "scripts/output.sh exists with emit_result and emit_error functions",
    "All composing scripts (resolve-repo.sh, validate-branch-name.sh, merge-base-into-feature.sh) use emit_error",
    "All tests pass"
  ],
  "repo": "HARNESS"
}
