{
  "ticket_id": "HARNESS-7",
  "title": "Metrics Collection",
  "type": "Story",
  "requirements": "Track cycle time, stage durations, retry rates, and learning effectiveness.\n\n1. Create schemas/metrics.schema.json with fields:\n   - ticket, started_at, completed_at (nullable), outcome (enum: completed, escalated, aborted), cycle_time_seconds (nullable), stages array (name, started_at, completed_at, duration_seconds, retries, escalated), tasks object (total, completed, retried, blocked), qa object (auto_fix_runs, auto_fix_resolved, test_failures, test_retries), review object (critic_rounds, pr_feedback_rounds, escalations), learning object (standing_instructions_injected, patterns_detected, repairs_applied)\n\n2. Create scripts/collect-metrics.sh:\n   - Args: <ticket_id>\n   - Parses run.log (JSONL) to extract stage transitions, retry counts, error counts\n   - Reads PRD.json for task counts, REVIEW.json for critic rounds, FEEDBACK.json for PR feedback rounds, ESCALATION.json for escalation count\n   - Computes cycle time from first to last log entry, per-stage durations\n   - Writes runs/{ticket_id}/METRICS.json\n   - Validates against metrics.schema.json\n\n3. Create scripts/aggregate-metrics.sh:\n   - Scans all runs/*/METRICS.json\n   - Computes: average cycle time (overall + per stage), escalation rate, most common escalation categories, retry rate per agent, auto-fix resolution rate, critic rounds distribution, learning system effectiveness\n   - Output: JSON summary\n\n4. Integrate metrics into run summary:\n   - Update run-summary.sh: call collect-metrics.sh at end of every run\n   - Add key metrics to terminal banner (cycle time, task completion, escalations)\n\n5. Dashboard metrics tab:\n   - Update dashboard/server.js: serve METRICS.json + aggregate metrics\n   - Update dashboard/index.html: add Metrics tab (global) with cycle time trend, escalation rate, retry heatmap, learning effectiveness. Per-ticket: stage duration breakdown, task progress\n\n6. Write tests:\n   - Test collect-metrics.sh with a completed run's run.log\n   - Test collect-metrics.sh with an escalated run\n   - Test aggregate-metrics.sh with multiple runs\n   - Test dashboard metrics tab renders",
  "acceptance_criteria": [
    "schemas/metrics.schema.json exists with all required fields",
    "scripts/collect-metrics.sh parses run.log and produces valid METRICS.json",
    "scripts/aggregate-metrics.sh computes averages across multiple runs",
    "run-summary.sh calls collect-metrics.sh at end of every run",
    "Terminal banner includes cycle time, task completion, escalation counts",
    "Dashboard has Metrics tab with cycle time trend, escalation rate, retry heatmap",
    "Per-ticket view shows stage duration breakdown and task progress",
    "All tests pass"
  ],
  "repo": "HARNESS",
  "linked_issues": ["HARNESS-3", "HARNESS-4"]
}
