{
  "ticket_id": "HARNESS-9",
  "title": "Concurrency Safety",
  "type": "Story",
  "requirements": "Prevent data corruption when multiple runs access shared state files.\n\n1. Create scripts/flock.sh with cross-platform file locking:\n   - Primary: mkdir-based locking (atomic on all platforms including Windows/MSYS, macOS, Linux)\n   - with_lock() function that takes lockdir path + command to run\n   - Lock timeout configurable via AGENT_LOCK_TIMEOUT env var (default 10s)\n   - Stale lock detection: if lockdir exists and is older than 5 minutes, remove it (dead process)\n   - On timeout: emit_error with lock timeout message, return 1\n   - Cleanup trap to remove lockdir on EXIT\n\n2. Protect shared state files with with_lock:\n   - AGENT_LEARNING.json: used by agent-learning.sh (write, lifecycle, increment-runs)\n   - REPAIR_KNOWLEDGE.json: used by auto-repair.sh (record, promote, mark-failed)\n   - runs/{ticket_id}/loops.json: used by check-loop-limit.sh\n   - runs/{ticket_id}/retries.json: used by check-retry-limit.sh\n   - runs/{ticket_id}/failures.json: used by auto-repair.sh track-failure\n\n3. PID-based run exclusion:\n   - Update scripts/pid.sh:\n     - On run start: write PID file to runs/{ticket_id}/pid.json\n     - Before writing PID: check if existing PID is still running\n     - If existing PID alive for same ticket: abort new run with 'already running' error\n     - On run end (normal/abort): remove PID file\n   - Prevent two concurrent runs on the same ticket\n\n4. Write tests:\n   - Test with_lock with concurrent writes (expect no corruption)\n   - Test stale lock detection (create old lockdir, expect auto-cleanup)\n   - Test PID exclusion: start run, attempt second run on same ticket (expect rejection)\n   - Test lock timeout: hold lock, attempt second lock with short timeout (expect timeout error)",
  "acceptance_criteria": [
    "scripts/flock.sh exists with with_lock() function using mkdir-based locking",
    "Locking works cross-platform: Windows/MSYS, macOS, Linux",
    "Stale locks older than 5 minutes are automatically cleaned",
    "Lock timeout is configurable via AGENT_LOCK_TIMEOUT",
    "All shared state files (AGENT_LEARNING.json, REPAIR_KNOWLEDGE.json, loops.json, retries.json, failures.json) are protected with with_lock",
    "scripts/pid.sh prevents concurrent runs on same ticket via PID checking",
    "PID file cleaned up on normal and abnormal exit",
    "All tests pass"
  ],
  "repo": "HARNESS"
}
