{
  "ticket_id": "HARNESS-2",
  "title": "Toolchain Abstraction",
  "type": "Story",
  "requirements": "Decouple QA/regression from Node.js. Enable any language/framework per repo via toolchain config.\n\n1. Extend repos.json schema with toolchain object per-repo:\n   - Fields: install, typecheck, lint, lint_fix, format_check, test, integration_test, build\n   - Null values mean 'skip this step'\n   - Update repos.json.example with toolchain section\n   - Add toolchain validation to preflight.sh (warn if commands not found)\n\n2. Create scripts/resolve-toolchain.sh:\n   - Args: <project_key> <step> (e.g., SHRED test)\n   - Reads repos.json, extracts toolchain command for step\n   - If null or missing: output {\"skip\": true, \"reason\": \"not configured\"}\n   - If present: output {\"skip\": false, \"command\": \"npm test\"}\n   - Exit 0 always (null is valid, means skip)\n\n3. Update QA agent scripts:\n   - Update regression-guard.sh: replace hardcoded npx tsc --noEmit, npm test, prettier/eslint with resolve-toolchain.sh calls. Skip any step where resolve-toolchain returns skip: true\n   - Update worktree-init.sh: replace hardcoded npm install with resolve-toolchain.sh $PROJECT_KEY install, replace hardcoded tsc baseline check with resolve-toolchain.sh $PROJECT_KEY typecheck\n\n4. Update agent prompts for toolchain awareness:\n   - Update agents/qa-agent.md: reference toolchain config instead of hardcoded npm/tsc\n   - Update agents/developer-agent.md: note that test commands come from toolchain config\n   - Update agents/conflict-resolution-agent.md: regression guard uses toolchain config\n\n5. Update CLAUDE.md:\n   - Add toolchain resolution to worktree setup section\n   - Update QA pipeline section to reference toolchain config\n   - Update script reference table with resolve-toolchain.sh\n\n6. Write tests:\n   - Test resolve-toolchain.sh with existing config (expect npm commands)\n   - Test resolve-toolchain.sh with null step (expect skip)\n   - Test resolve-toolchain.sh with unknown project (expect error)\n   - Test regression-guard.sh with toolchain resolution\n   - Test regression-guard.sh with all-null toolchain (expect all steps skipped)",
  "acceptance_criteria": [
    "repos.json schema supports toolchain object with install, typecheck, lint, lint_fix, format_check, test, integration_test, build fields",
    "Null toolchain values mean skip that step",
    "scripts/resolve-toolchain.sh exists and resolves commands from repos.json",
    "resolve-toolchain.sh outputs JSON with skip and command fields",
    "regression-guard.sh uses resolve-toolchain.sh instead of hardcoded commands",
    "worktree-init.sh uses resolve-toolchain.sh instead of hardcoded commands",
    "Agent prompts (qa-agent.md, developer-agent.md, conflict-resolution-agent.md) reference toolchain config",
    "CLAUDE.md updated with toolchain resolution in worktree setup and QA pipeline",
    "Script reference table includes resolve-toolchain.sh",
    "All tests pass"
  ],
  "repo": "HARNESS",
  "linked_issues": ["HARNESS-1"]
}
