{
  "ticket_id": "HARNESS-11",
  "title": "Learning Effectiveness, Dependency Viz & Revert Mode",
  "type": "Story",
  "requirements": "Measure standing instruction impact. Visualize ticket dependencies. Mechanical undo for bad merges.\n\n1. Learning effectiveness scoring:\n   - Update agent-learning.schema.json: add runs_with_instruction (integer), effectiveness_score (number 0-1)\n   - Update scripts/agent-learning.sh: increment-runs increments runs_with_instruction for active entries, lifecycle computes effectiveness_score on every transition, new action 'prune' auto-dismisses entries with effectiveness < 0.5 after 10+ runs (mark as 'ineffective')\n   - Add 'ineffective' to status enum in schema\n\n2. Dependency graph script:\n   - Create scripts/dependency-graph.sh: Args: <ticket_id>\n   - Walks Jira linked issues (blocked-by, blocks) up to depth 3\n   - For each linked ticket: fetch status + PR status\n   - Output modes: --json (structured JSON nodes + edges), --ascii (ASCII art tree), --dot (DOT format for Graphviz)\n   - Color coding: green=done, yellow=in-progress, red=blocked, grey=not-started\n\n3. Dashboard dependencies tab:\n   - Add Dependencies tab per ticket\n   - Render dependency graph (simple SVG or text-based)\n   - Show status of each linked ticket, highlight blocking path\n\n4. Revert mode:\n   - Add --revert flag to parse-args.sh (usage: PROJ-123 --revert), sets mode: 'revert'\n   - Create scripts/revert-run.sh: Args: <ticket_id>\n     - Look up archived artifacts in runs/{ticket_id}/\n     - Find merged PR number + merge commit from PRD.json\n     - Create revert branch: {code}_{ticket_id}_revert_{type}\n     - Create worktree at standard path\n     - Run git revert <merge_commit> --no-edit in worktree\n     - Run tests via toolchain (resolve-toolchain.sh test) -- fail = escalate\n     - Run secret scan -- fail = escalate\n     - Skip Critic review entirely (mechanical undo)\n     - Open PR linking to original PR with revert context\n     - If jira: post comment on ticket noting revert\n   - Output: revert PR URL\n\n5. Add revert to Makefile:\n   - Add revert target: claude --permission-mode bypassPermissions '/start $(TICKET) --revert'\n\n6. Write tests:\n   - Test effectiveness scoring after 10 runs with no recurrence\n   - Test prune action on low-effectiveness entry\n   - Test dependency-graph.sh output formats\n   - Test revert mode with a previously merged ticket\n   - Test revert mode with test failure (expect escalation)",
  "acceptance_criteria": [
    "agent-learning.schema.json has runs_with_instruction and effectiveness_score fields",
    "agent-learning.sh increment-runs updates runs_with_instruction for active entries",
    "agent-learning.sh prune marks entries with effectiveness < 0.5 after 10+ runs as ineffective",
    "scripts/dependency-graph.sh supports --json, --ascii, and --dot output modes",
    "Dashboard shows Dependencies tab per ticket with graph visualization",
    "parse-args.sh supports --revert flag setting mode to revert",
    "scripts/revert-run.sh creates revert branch, runs tests and secret scan, opens PR",
    "Revert mode skips Critic review",
    "Makefile has revert target",
    "All tests pass"
  ],
  "repo": "HARNESS",
  "linked_issues": ["HARNESS-4", "HARNESS-7"]
}
